prodcode,dmdcode,gemscriptcode,therapyevents,productname,ingredient,strength,formulation,routeofadministration,bnftext,v12,v13,v14,v15,v16,v17,v18,v19,v20,v21,slashcountinchapter,bnfchapter
47200,9110711000001100,453021,3,Propain Plus caplets (Ceuta Healthcare Ltd),Paracetamol/Doxylamine succinate/Caffeine/Codeine phosphate,450mg + 5mg + 30mg + 10mg,Tablet,Oral,Analgesics,May 2012,18889001,,,,,,,,,0,4070000
32519,7951411000001104,86609020,13,Painex caplets (Sandoz Ltd),Paracetamol/Doxylamine succinate/Caffeine/Codeine phosphate,450mg + 5mg + 30mg + 10mg,Tablet,Oral,Analgesics/Non-Opioid And Compound Analgesics/Opioid Analgesics,February 2009,11886001,,,,,,,,,2,4070000
21251,3996611000001107,82938020,204,Ultramol Soluble tablets (Sanofi),Paracetamol/Codeine phosphate/Caffeine,500mg + 8mg + 30mg,Effervescent tablet,Oral,Analgesics/Opioid Analgesics,February 2009,10234001,,,,,,,,,1,4070000
32891,7951011000001108,51786020,52,Syndol caplets (Sanofi),Paracetamol/Doxylamine succinate/Caffeine/Codeine phosphate,450mg + 5mg + 30mg + 10mg,Tablet,Oral,Analgesics,February 2009,914002,,,,,,,,,0,4070000
36152,4769311000001102,90897020,31,Propain caplets (Ceuta Healthcare Ltd),Paracetamol/Codeine phosphate/Diphenhydramine hydrochloride/Caffeine,400mg + 10mg + 5mg + 50mg,Tablet,Oral,Analgesics,February 2009,14041001,,,,,,,,,0,4070000
30958,4871811000001102,73444020,1,Resolve effervescent granules 8.09g sachets (G.R. Lane Health Products Ltd),Sodium carbonate/Ascorbic acid/Potassium bicarbonate/Sodium bicarbonate/Paracetamol/Citric acid anhydrous,153mg + 30mg + 715mg + 808mg + 1gram + 1.185gram,Effervescent granules,Oral,Indigestion And GORD (Gastro-Oesophageal Reflux Disease)/Analgesics,February 2009,6656001,,,,,,,,,1,4070000
53327,9814611000001108,21767020,17,Migraine Kool'n'Soothe soft gel sheets (Kobayashi Healthcare Europe Ltd),,,,,Analgesics,January 2013,21767020,,,,,,,,,0,4070000
56934,9814811000001108,21768020,4,Kool'n'Soothe for Children soft gel sheets (Kobayashi Healthcare Europe Ltd),,,,,Analgesics,August 2013,21768020,,,,,,,,,0,4070000
