prodcode,dmdcode,gemscriptcode,therapyevents,productname,ingredient,strength,formulation,routeofadministration,bnftext,v12,v13,v14,v15,v16,v17,v18,v19,v20,v21,slashcountinchapter,bnfchapter
948,424511000001102,55332020,277611,Emulsiderm emollient (Dermal Laboratories Ltd),Liquid paraffin/Isopropyl myristate/Benzalkonium chloride,250mg/1gram + 250mg/1gram + 5mg/1gram,Bath additive,Cutaneous,Antimicrobial Emollients,February 2009,1840001,,,,,,,,,0,13020103
51617,7660511000001101,18114020,330,Generic Dermol cream,Liquid paraffin/Isopropyl myristate/Benzalkonium chloride/Chlorhexidine hydrochloride,100mg/1gram + 100mg/1gram + 1mg/1gram + 1mg/1gram,Cream,Cutaneous,Antimicrobial Emollients,January 2013,18114020,,,,,,,,,0,13020103
50261,3395411000001105,11763020,361,Generic Dermol 500 lotion,Benzalkonium chloride/Chlorhexidine hydrochloride/Liquid paraffin/Isopropyl myristate,1mg/1gram + 1mg/1gram + 25mg/1gram + 25mg/1gram,Liquid,Cutaneous,Antimicrobial Emollients,January 2013,11763020,,,,,,,,,0,13020103
63374,3465711000001106,12546020,12,Generic Emulsiderm emollient,Liquid paraffin/Isopropyl myristate/Benzalkonium chloride,250mg/1gram + 250mg/1gram + 5mg/1gram,Bath additive,Cutaneous,Antimicrobial Emollients,June 2015,12546020,,,,,,,,,0,13020103
6993,7644411000001100,88028020,518421,Dermol cream (Dermal Laboratories Ltd),Liquid paraffin/Isopropyl myristate/Benzalkonium chloride/Chlorhexidine hydrochloride,100mg/1gram + 100mg/1gram + 1mg/1gram + 1mg/1gram,Cream,Cutaneous,Antimicrobial Emollients,February 2009,12588001,,,,,,,,,0,13020103
1600,553611000001106,82373020,1649684,Dermol 500 lotion (Dermal Laboratories Ltd),Benzalkonium chloride/Chlorhexidine hydrochloride/Liquid paraffin/Isopropyl myristate,1mg/1gram + 1mg/1gram + 25mg/1gram + 25mg/1gram,Liquid,Cutaneous,Antimicrobial Emollients,February 2009,9981001,,,,,,,,,0,13020103
