prodcode,dmdcode,gemscriptcode,therapyevents,productname,ingredient,strength,formulation,routeofadministration,bnftext,v12,v13,v14,v15,v16,v17,v18,v19,v20,v21,slashcountinchapter,bnfchapter
67891,2.39260110000e+16,22910021,6,Aqua Maris Junior nasal spray (AHA Sales Services Ltd),,,Spray,,Nasal Spray,October 2016,22910021,,,,,,,,,0,12500200
52086,2.12458110000e+16,45280020,4207,Sterimar Baby 31.8% isotonic nasal spray (Church & Dwight UK Ltd),,,Spray,,Nasal Spray/Nasal Spray Isotonic,January 2013,45280020,,,,,,,,,1,12500200
39939,1.54129110000e+16,4987021,183510,Sterimar 31.8% isotonic nasal spray (Church & Dwight UK Ltd),,,Spray,,Nasal Spray/Nasal Spray Isotonic,August 2009,23180005,,,,,,,,,1,12500200
61643,2.39258110000e+16,22909021,22,Aqua Maris Daily nasal spray (AHA Sales Services Ltd),,,Spray,,Nasal Spray,November 2014,22909021,,,,,,,,,0,12500200
40006,1.54131110000e+16,4990021,32066,Sterimar 75% hypertonic nasal spray (Church & Dwight UK Ltd),,,Spray,,Nasal Spray/Nasal Spray Hypertonic,August 2009,23183005,,,,,,,,,1,12500200
65470,1.54386110000e+16,36302020,4,Sea water nasal spray,,,Spray,,Nasal Spray/Nasal Spray Isotonic,February 2016,36302020,,,,,,,,,1,12500200
63960,2.39262110000e+16,22911021,4,Aqua Maris Strong nasal spray (AHA Sales Services Ltd),,,Spray,,Nasal Spray,August 2015,22911021,,,,,,,,,0,12500200
